V1,V2,V3,V4,V5,Q11,Q2,Q10,Q12,Q3,Q4_1,Q4_2,Q4_3,Q4_4,Q4_5,Q4_6,Q5,Q6,Q7,Q8,Q9,
ResponseID,ResponseSet,StartDate,EndDate,Finished,Project title: Validating statistical methods to detect (potential) data fabrication.   This stud...,"In this survey, we request you to fake research results for a set of four anchoring studies (Jaco...",Please save your filled in version of the template file and upload it with the option below.,"In order to further the understanding of how researchers might fake research results, we would li...",How would you qualify your current knowledge of statistical methods?,Which statistical analysis programs do you frequently use (multiple answers possible)?-SPSS,Which statistical analysis programs do you frequently use (multiple answers possible)?-R,Which statistical analysis programs do you frequently use (multiple answers possible)?-Stata,Which statistical analysis programs do you frequently use (multiple answers possible)?-SAS,Which statistical analysis programs do you frequently use (multiple answers possible)?-Matlab,Which statistical analysis programs do you frequently use (multiple answers possible)?-Other,Please describe freely how you fabricated the research results for the four anchoring studies. Th...,Did you simulate data for fabricating the results of at least one of the anchoring studies?,Did you fabricate an entire dataset for at least one of the anchoring studies?,"Did you use trial-and-error in fabricating the results, such that the wanted result was achieved?",Do you have any further remarks regarding the fabrication of the research results in one or more...,
R_124DW2C8FOWUJJn,Default Response Set,2015-09-21 15:57:53,2015-09-21 16:15:51,1,1,1,http://co1.qualtrics.com/WRQualtricsControlPanel/File.php?Filename=templateJB.xlsx&Size=22206&Type=application%2Fvnd.openxmlformats-officedocument.spreadsheetml.sheet&F=F_2B5P3tivxyHwk40,1,5,1,1,,,,,"partly based on intuition about likely means and SD's in both conditions, and partly based on a random number generator. in the number generator i gave the min and max of the numbers based on what numbers i used for one condition/gender. Also a couple of decimals were randomly generated.",2,2,2,,
R_3hcMrBwyRMxkuOw,Default Response Set,2015-09-24 23:15:50,2015-09-24 23:44:59,1,1,1,http://co1.qualtrics.com/WRQualtricsControlPanel/File.php?Filename=template.xlsx&Size=500709&Type=application%2Fvnd.openxmlformats-officedocument.spreadsheetml.sheet&F=F_psohLjr106VQQV3,1,6,1,1,,,,,Let's see first whether you can detect it's fake. ;),1,1,1,,
R_BXLJRT0jFkm9kM9,Default Response Set,2015-09-25 11:12:21,2015-09-25 12:09:00,1,1,1,http://co1.qualtrics.com/WRQualtricsControlPanel/File.php?Filename=datafabrication.xlsx&Size=23268&Type=application%2Fvnd.openxmlformats-officedocument.spreadsheetml.sheet&F=F_2t9YgTJVJyv6it7,1,7,,1,,,,,"I simulated normally distributed data for the two conditions based on the data in the paper of Jacowitz &  Kahneman. See the R code below as an example. /  / I'm not sure if in the end this was the best method, since the simulated data contains impossible values. I'm not sure if you can see this in the summary statistics. /  /  / # san francisco - new york /  / n1 <- 53 / n2 <- 47 /  / low <- round(rnorm(n1,2600,1200),0) / high <- round(rnorm(n2,4000,1500),0) /  / low_gender <- sample(c(""male"",""female""),n1,replace=TRUE) / high_gender <- sample(c(""male"",""female""),n2,replace=TRUE) /  / data <- data.frame(estimate=c(low,high), /                    condition=c(rep(""low"",n1),rep(""high"",n2)), /                    gender=c(low_gender,high_gender)) /  / summary(aov(lm(estimate~condition,data=data))) / summary(aov(lm(estimate~gender,data=data))) / summary(aov(lm(estimate~condition*gender,data=data))) /  / # low anchor /  / table(data$gender[data$condition==""low""]) /  / mean(data$estimate[data$gender==""male"" & data$condition==""low""]) / mean(data$estimate[data$gender==""female"" & data$condition==""low""]) /  / sd(data$estimate[data$gender==""male"" & data$condition==""low""]) / sd(data$estimate[data$gender==""female"" & data$condition==""low""]) /  / # high anchor /  / table(data$gender[data$condition==""high""]) /  / mean(data$estimate[data$gender==""male"" & data$condition==""high""]) / mean(data$estimate[data$gender==""female"" & data$condition==""high""]) /  / sd(data$estimate[data$gender==""male"" & data$condition==""high""]) / sd(data$estimate[data$gender==""female"" & data$condition==""high""])",1,1,1,"I wasn't sure if I had to show the desired results in each of the 4 studies. In order to make the studies look more believable, I would have fabricated data in such a way that one of the studies wouldn't show an effect. ",
R_PtARPjR5zNQZP8d,Default Response Set,2015-09-24 08:54:50,2015-09-24 09:32:14,0,1,,,,,,,,,,,,,,,,
